{
  "schema_version": "2.0",
  "catalog_type": "metric_package",
  "package_id": "atomic.effective-ways-capacity",
  "type": "atomic",
  "category": "settlement",
  "version": "2.3.0",
  "applies_when": {
    "mechanic_id": "settlement.effective-ways-capacity"
  },
  "metrics": [
    {
      "metric_id": "effective_ways.capacity_distribution",
      "name_zh": "最终实际有效Ways容量分布",
      "owner": "atomic.effective-ways-capacity",
      "category": "settlement",
      "display_order": 10,
      "kind": "score",
      "unit": "probability",
      "scope_template": "component×state×board_phase×capacity_scope×geometry_layout",
      "measurement": "P(exact final_effective_ways_capacity | sealed capacity_scope_id, geometry_layout_id), fields capacity_scope_id|geometry_layout_id::effective_capacity",
      "sample_unit": "eligible_non_cascade_ways_board×declared_capacity_scope×geometry_layout",
      "condition_on": "不属于Cascade结算步骤的合格Ways判定盘面、画像密封的capacity_scope和真实geometry_layout_id；按effective_capacity_formula把几何布局及Split Symbol、超大符号、多重计数等非几何输入合成为最终实际可用容量",
      "normalization": "每个capacity_scope_id|geometry_layout_id组内精确最终容量的有序概率合计为1；固定布局使用唯一几何组；实际容量位置和条件组权重由任务合同密封，距离固定按log10(1+x)后的1个十倍数量级计量",
      "applicability_rule": "同时存在settlement.ways和settlement.effective-ways-capacity时加载；可与board.fixed-grid或board.variable-grid共存。局部退化的容量作用域×几何布局组移除并按原版活动组权重重新归一，至少一个组具有两个及以上结构可达最终容量值时评分。全部容量组恒定时整项按退化支持标记不适用。同一Cascade事件集改由cascade.effective_capacity_distribution_by_depth拥有并按Owner互斥。",
      "missing_policy": "非Cascade边界、capacity_scope、capacity_domain、effective_capacity_formula、观测点、逐盘输入事实或实际容量任一缺失时阻塞FORMAL；不得用理论最大Ways或中奖实际Ways数替代可用容量，也不得把Cascade步骤混入本指标。",
      "inapplicability_reason_codes": [
        "degenerate_reachable_support",
        "semantic_owner_exclusive"
      ],
      "capability_ids": [
        "board.fixed-grid",
        "board.variable-grid",
        "settlement.ways",
        "settlement.effective-ways-capacity"
      ],
      "profile_match": {
        "mechanic_id_all": [
          "settlement.ways",
          "settlement.effective-ways-capacity"
        ],
        "required_attributes": [
          "capacity_scope",
          "capacity_domain",
          "geometry_layout_domain",
          "geometry_layout_binding",
          "effective_capacity_formula",
          "capacity_observation_point"
        ]
      },
      "semantic_variable_id": "effective_ways.actual_capacity",
      "semantic_group": "effective_ways_capacity",
      "semantic_role": "primary",
      "relationships": {
        "derived_from": [],
        "cross_checks_with": [
          "cascade.effective_capacity_distribution_by_depth"
        ],
        "marginal_of": [],
        "conditional_on_metric": [],
        "exclusive_with": [
          "cascade.effective_capacity_distribution_by_depth"
        ],
        "overlap_reason_zh": "本指标只拥有非Cascade中几何布局与非几何规则合成后的最终实际Ways容量；同一Cascade步骤的容量由cascade.effective_capacity_distribution_by_depth按层级条件拥有。可变网格的几何基础容量仍由atomic.variable-grid作0权重派生核对，不重复最终容量。"
      },
      "display": {
        "description_zh": "衡量几何布局与Split Symbol、超大符号或多重计数等规则合成后，最终实际可用Ways容量怎样变化。",
        "usage_scene_zh": "用于发现固定或可变网格外观看似正确，但同一几何布局下实际结算机会容量分布错误。",
        "target_meaning_zh": "每组目标值统计指定容量作用域和真实几何布局条件下，合格非Cascade盘面的最终实际Ways容量恰好等于对应值的比例。",
        "display_unit": "%（指定容量作用域与几何布局的非Cascade盘面占比）"
      },
      "score_group": "settlement_diversity",
      "score_budget_key": "effective_ways.capacity_distribution",
      "scope_aggregation": "weighted_mean",
      "default_weight": 1,
      "score_profile": {
        "method": "grouped_wasserstein_1d",
        "bin_positions_source": "task_contract",
        "axis_semantics": "nonnegative_multiplicative",
        "position_transform": "log10_1p",
        "distance_normalization": "fixed_transform_unit",
        "distance_scale": 1,
        "distance_unit": "log10_decade",
        "group_separator": "::",
        "normalization_tolerance": 0.000001,
        "group_weight_source": "task_contract",
        "anchors": [
          [0, 100],
          [0.02, 95],
          [0.05, 85],
          [0.1, 70],
          [0.2, 50],
          [0.5, 0]
        ]
      }
    },
    {
      "metric_id": "effective_ways.return_distribution_by_capacity",
      "name_zh": "固定布局不同有效Ways容量下的回报分布",
      "owner": "atomic.effective-ways-capacity",
      "category": "settlement",
      "display_order": 20,
      "kind": "score",
      "unit": "probability",
      "scope_template": "component×state×board_phase×capacity_scope",
      "measurement": "P(return_bucket | sealed capacity_scope_id, effective_capacity_bucket), fields capacity_scope_id|effective_capacity::return_bucket",
      "sample_unit": "eligible_non_cascade_fixed_grid_ways_settlement_step×declared_capacity_scope",
      "condition_on": "指定容量作用域和实际有效Ways容量的非Cascade固定布局Ways结算步骤；回报按return_binding_rule绑定到同一结算事实，0x步骤必须保留",
      "normalization": "每个capacity_scope_id|effective_capacity组内从独立0x起的有序回报桶概率合计为1；条件组权重由任务合同密封",
      "applicability_rule": "固定布局动态有效Ways容量与对应非Cascade结算回报可一一绑定时必需；Cascade步骤或可变网格容量步骤不适用。局部退化的capacity_scope_id|effective_capacity组移除并按原版活动组权重重新归一；全部回报条件组退化时整项按退化支持标记不适用。",
      "missing_policy": "return_binding_rule、容量到结算的绑定、逐步实际容量、回报分母、独立0x桶或任一实际桶边界缺失时阻塞FORMAL。",
      "inapplicability_reason_codes": ["degenerate_reachable_support", "semantic_owner_exclusive"],
      "capability_ids": [
        "board.fixed-grid",
        "settlement.ways",
        "settlement.effective-ways-capacity"
      ],
      "profile_match": {
        "mechanic_id_all": [
          "board.fixed-grid",
          "settlement.ways",
          "settlement.effective-ways-capacity"
        ],
        "required_attributes": [
          "capacity_scope",
          "effective_capacity_formula",
          "return_binding_rule"
        ]
      },
      "semantic_variable_id": "effective_ways.return_given_actual_capacity",
      "semantic_group": "effective_ways_outcome",
      "semantic_role": "primary",
      "relationships": {
        "derived_from": [],
        "cross_checks_with": [],
        "marginal_of": [],
        "conditional_on_metric": [
          "effective_ways.capacity_distribution"
        ],
        "exclusive_with": [
          "settlement.step_return_distribution",
          "cascade.step_return_distribution_by_depth",
          "variable_grid.return_distribution_by_capacity"
        ],
        "overlap_reason_zh": "本指标只拥有非Cascade固定布局动态Ways容量步骤的容量条件回报；Cascade由层级×effective_capacity回报Owner承接，可变网格由布局容量回报Owner承接。"
      },
      "display": {
        "description_zh": "衡量固定布局下，较低和较高实际有效Ways容量分别产生怎样的完整步骤回报。",
        "usage_scene_zh": "用于发现容量分布看似正确，但不同容量档位的中奖能力与原版不一致。",
        "target_meaning_zh": "每组目标值统计指定容量作用域和实际有效Ways容量条件下，完整结算步骤回报落入各倍率桶的比例。",
        "display_unit": "%（指定容量条件结算步骤占比）"
      },
      "score_group": "settlement_diversity",
      "score_budget_key": "effective_ways.return_distribution_by_capacity",
      "scope_aggregation": "weighted_mean",
      "default_weight": 1,
      "score_profile": {
        "method": "grouped_wasserstein_1d",
        "bin_positions_source": "task_contract",
        "axis_semantics": "nonnegative_multiplicative",
        "position_transform": "log10_1p",
        "distance_normalization": "fixed_transform_unit",
        "distance_scale": 1,
        "distance_unit": "log10_decade",
        "group_separator": "::",
        "normalization_tolerance": 0.000001,
        "group_weight_source": "task_contract",
        "anchors": [
          [0, 100],
          [0.02, 95],
          [0.05, 85],
          [0.1, 70],
          [0.2, 50],
          [0.5, 0]
        ]
      }
    }
  ]
}
