{
  "schema_version": "2.0",
  "catalog_type": "metric_package",
  "package_id": "interaction.multiplier-return",
  "type": "interaction",
  "category": "interaction",
  "version": "2.2.0",
  "applies_when": {
    "mechanic_id": "modifier.win-multiplier",
    "required_attributes": [
      "return_dependency_evidence"
    ]
  },
  "metrics": [
    {
      "metric_id": "multiplier.return_dependence_residual",
      "name_zh": "倍率与倍率前回报依赖残差",
      "owner": "interaction.multiplier-return",
      "category": "interaction",
      "display_order": 10,
      "kind": "score",
      "unit": "probability_difference",
      "scope_template": "modifier.win-multiplier×component×state×settlement_scope",
      "measurement": "residual(control_stratum,pre_multiplier_return_bucket,effective_multiplier_state)=P(effective_multiplier_state|control_stratum,pre_multiplier_return_bucket,eligible_positive_pre_multiplier_win)-P(effective_multiplier_state|control_stratum,eligible_positive_pre_multiplier_win)",
      "sample_unit": "eligible_positive_pre_multiplier_win_resolution",
      "condition_on": "倍率应用前已经形成正向中奖、且属于该倍率规则作用域的一次合格结算；先按return_dependency_evidence.control_stratum_fields控制Cascade深度、持久倍率状态、Wild辅助状态及其他直接驱动，再比较同一控制层内的倍率前回报桶；倍率状态必须包含未应用或1x状态以及所有实际生效倍率档",
      "normalization": "字段使用control_stratum|pre_multiplier_return_bucket::effective_multiplier_state；每个control_stratum|pre_multiplier_return_bucket组的倍率状态残差合计为0，组内先平均字段绝对误差，再按group_weights[控制层×倍率前回报桶]=原版共享合格正向中奖事件集中该组占比汇总；控制层、回报桶和倍率状态域均在候选出现前密封，残差不是概率分布",
      "applicability_rule": "仅当结构化return_dependency_evidence绑定唯一共享语义事件集、controlled_driver_node_ids完整覆盖全部Cascade深度、持久倍率状态、Wild等直接驱动节点、control_stratum_fields可复算、joint_observation_rule可执行，且residual_dependence_after_control=true时加载；控制后依赖消失或普通共存不加载。",
      "missing_policy": "已命中时，结构化依赖合同任一必需字段、直接驱动节点闭合、共享事件集、控制分层、倍率前回报、最终倍率状态、联合观测规则、合格作用域或密封分桶任一缺失即阻塞该Interaction实例。",
      "capability_ids": [
        "modifier.win-multiplier"
      ],
      "profile_match": {
        "mechanic_id": "modifier.win-multiplier",
        "required_attributes": [
          "return_dependency_evidence"
        ]
      },
      "semantic_variable_id": "interaction.multiplier_return_dependence_residual",
      "semantic_group": "interaction_dependency",
      "semantic_role": "primary",
      "relationships": {
        "derived_from": [],
        "cross_checks_with": [
          "multiplier.occurrence_rate",
          "multiplier.application_rate_given_occurrence",
          "multiplier.effective_value_distribution",
          "cascade_multiplier.dependence_by_depth",
          "persistent_state.ordered_value_distribution",
          "wild_multiplier.dependence_residual"
        ],
        "marginal_of": [],
        "conditional_on_metric": [],
        "overlap_reason_zh": "Atomic指标负责倍率出现、应用和有效值边际，Cascade、持久状态与Wild Interaction负责各直接驱动关系；本指标只评价控制全部已登记直接驱动后，倍率前中奖大小与倍率状态之间仍不能由这些Owner解释的剩余依赖。"
      },
      "display": {
        "description_zh": "衡量在Cascade深度、持久倍率状态、Wild等直接驱动完全相同后，高低倍率是否仍系统性偏向不同大小的倍率前中奖。",
        "usage_scene_zh": "用于识别不能由已登记倍率驱动关系解释的额外中奖大小联动；普通独立倍率、普通共存或仅由Cascade、持久状态、Wild间接造成的相关都不使用。",
        "target_meaning_zh": "每个目标值表示同一真实控制层和倍率前回报档下，一种倍率状态的出现概率比该控制层总体概率高或低多少。",
        "display_unit": "百分点差（控制直接驱动后的剩余概率差）"
      },
      "score_group": "interaction",
      "score_budget_key": "multiplier.return_dependence_residual",
      "scope_aggregation": "weighted_mean",
      "default_weight": 1,
      "score_profile": {
        "method": "grouped_mean_absolute_error",
        "group_separator": "::",
        "group_weight_source": "task_contract",
        "normalization_tolerance": 0.000001,
        "anchors": [
          [0, 100],
          [0.005, 95],
          [0.015, 85],
          [0.04, 70],
          [0.08, 50],
          [0.25, 0]
        ]
      }
    }
  ]
}
